[{"arquivo":"Directory_Traversal/Dir_Traversal.py","linha_inicial":14,"linha_final":22,"cwe":"CWE-22","severidade":"alta","descricao":"O caminho solicitado pelo cliente é concatenado diretamente ao diretório de trabalho e usado em exists() e open(). A expressão regular bloqueia apenas caminhos que começam exatamente com dois segmentos ../, podendo ser contornada com um prefixo como /x/../../. Um atacante capaz de enviar requisições HTTP pode escapar do diretório de trabalho e ler arquivos acessíveis ao processo.","recomendacao":"Resolva o caminho com realpath() e permita somente resultados que permaneçam dentro de um diretório-base previamente definido, rejeitando qualquer caminho fora dessa raiz; não use a entrada bruta para selecionar arquivos."},{"arquivo":"Other/url_fetch.py","linha_inicial":13,"linha_final":16,"cwe":"CWE-918","severidade":"alta","descricao":"O parâmetro url controlado pelo atacante é usado diretamente em urllib.request.urlopen() e a resposta é devolvida ao solicitante. A verificação startswith(\"https://insecurewebapp.com\") não valida o host efetivo e pode ser contornada, por exemplo, com https://insecurewebapp.com@127.0.0.1/ ou com um domínio terminado em .com.evil. Isso permite requisições do servidor para destinos internos ou arbitrários alcançáveis por ele, com exposição do conteúdo retornado.","recomendacao":"Analise a URL com um parser, permita somente HTTPS e um host exato de uma allowlist, rejeite credenciais, redirecionamentos para destinos não permitidos e endereços privados, e não devolva diretamente o corpo da resposta ao cliente."}]
