[{"arquivo":"app/app.py","linha_inicial":35,"linha_final":35,"cwe":"CWE-89","severidade":"alta","descricao":"Os valores controlados por username e password são interpolados diretamente na consulta SQL. Um atacante pode enviar valores especialmente construídos no POST /login para alterar a cláusula WHERE e autenticar-se sem credenciais válidas, desde que o endpoint esteja acessível.","recomendacao":"Usar uma consulta parametrizada, por exemplo c.execute(\"SELECT * FROM users WHERE username = ? AND password = ?\", (username, password)), e armazenar senhas com hash seguro."},{"arquivo":"app/app.py","linha_inicial":41,"linha_final":43,"cwe":"CWE-639","severidade":"alta","descricao":"Após o login, o servidor grava no cookie session apenas o username, sem assinatura, integridade ou vínculo verificável com uma sessão autenticada. Como /dashboard aceita esse valor diretamente, um atacante pode forjar o cookie para se passar por qualquer usuário e acessar a área protegida.","recomendacao":"Usar o mecanismo de sessão assinado do Flask ou sessões server-side com identificador aleatório, e validar a autenticação e autorização em /dashboard."},{"arquivo":"app/app.py","linha_inicial":48,"linha_final":49,"cwe":"CWE-79","severidade":"alta","descricao":"O valor controlado pelo atacante no cookie session é inserido diretamente no HTML retornado por /dashboard. Um atacante pode definir esse cookie com markup ou JavaScript e, ao induzir uma vítima a visitar a rota, executar script no contexto da aplicação; a ausência de autenticação também permite alcançar a rota diretamente.","recomendacao":"Escapar o valor ao gerar HTML, preferencialmente renderizando um template com autoescape habilitado, e substituir o cookie por uma sessão validada."},{"arquivo":"app/app.py","linha_inicial":54,"linha_final":55,"cwe":"CWE-79","severidade":"alta","descricao":"O parâmetro GET q é refletido diretamente no HTML da resposta de /search sem escaping. Um atacante pode criar uma URL contendo HTML ou JavaScript e induzir uma vítima a acessá-la, executando script no contexto da aplicação.","recomendacao":"Renderizar o valor em template com autoescape habilitado ou aplicar escaping contextual apropriado antes de inseri-lo na resposta."}]
