{"arquivo":"Directory_Traversal/Dir_Traversal.py","linha_inicial":14,"linha_final":22,"cwe":"CWE-22","severidade":"alta","descricao":"O caminho controlado por self.path é concatenado diretamente ao diretório de trabalho e posteriormente usado em exists() e open(). A validação anterior bloqueia apenas o prefixo literal /../../, permitindo variantes como /arquivo/../../segredo. Um atacante que alcance o servidor HTTP pode ler arquivos acessíveis ao processo fora do diretório pretendido.","recomendacao":"Resolver o caminho com os.path.realpath() e rejeitá-lo se não permanecer dentro de um diretório-raiz permitido; usar essa validação antes de exists() e open()."}
