[{"arquivo":"app.py","linha_inicial":24,"linha_final":24,"cwe":"CWE-94","severidade":"alta","descricao":"Quando executado como programa principal, o servidor Flask é iniciado com debug=True e exposto em todas as interfaces. Um atacante que alcance o serviço pode provocar um erro e acessar o depurador interativo do Werkzeug, cuja exposição pode permitir execução arbitrária de código no processo, dependendo das proteções do depurador e da acessibilidade da interface.","recomendacao":"Desabilitar debug=True em execução de serviço e configurar o modo de depuração exclusivamente por mecanismo seguro e não habilitado em produção."},{"arquivo":"lfi.py","linha_inicial":16,"linha_final":16,"cwe":"CWE-22","severidade":"media","descricao":"O campo controlado pelo solicitante filename é passado diretamente a fetchfile, que abre o caminho recebido sem validar diretório permitido ou impedir caminhos absolutos e componentes .. . Um atacante com acesso ao endpoint pode ler arquivos arbitrários acessíveis ao processo e receber seu conteúdo na resposta.","recomendacao":"Restringir a leitura a um diretório fixo, resolver o caminho e verificar que ele permanece dentro desse diretório, além de usar uma allowlist de nomes quando possível."},{"arquivo":"rfi.py","linha_inicial":5,"linha_final":5,"cwe":"CWE-918","severidade":"alta","descricao":"O valor imagelink fornecido pelo solicitante é usado como URL em requests.get sem allowlist de esquemas, hosts ou redes de destino. Um atacante que alcance o endpoint pode fazer o servidor realizar requisições para serviços internos ou outros destinos arbitrários e devolver o corpo da resposta, caracterizando SSRF.","recomendacao":"Permitir somente hosts e esquemas explicitamente autorizados, bloquear destinos internos e de metadata, resolver e validar o IP final e aplicar controles de rede de saída."},{"arquivo":"sqli.py","linha_inicial":16,"linha_final":16,"cwe":"CWE-89","severidade":"alta","descricao":"O username controlado pelo solicitante é interpolado diretamente na consulta SQL. Um atacante pode alterar a cláusula WHERE por meio de sintaxe SQL e obter registros ou modificar a lógica da consulta; o endpoint retorna os resultados encontrados. O password apenas controla a entrada no bloco e não é usado para autenticação.","recomendacao":"Usar consulta parametrizada, por exemplo com cur.execute(\"SELECT * FROM USERS WHERE USERNAME=?\", (username,)), sem interpolar dados externos na instrução SQL."},{"arquivo":"ssti.py","linha_inicial":12,"linha_final":12,"cwe":"CWE-1336","severidade":"alta","descricao":"O valor mathexp controlado pelo solicitante é concatenado no texto de um template Jinja e depois compilado e renderizado. Isso permite que o atacante forneça expressões e construções de template avaliadas no servidor, com potencial de acessar objetos do contexto e, dependendo do ambiente, executar código; o resultado é retornado na resposta.","recomendacao":"Não compile entrada do usuário como template; mantenha o template estático e passe mathexp como variável para renderização com escape e, se expressão matemática for necessária, use um avaliador restrito a uma gramática segura."}]
