[{"arquivo":"backend/app.py","linha_inicial":228,"linha_final":228,"cwe":"CWE-489","severidade":"media","descricao":"A aplicação é iniciada com debug=True. Se o servidor for executado dessa forma e um atacante alcançar uma requisição que cause erro, o depurador do Flask pode expor informações internas e, dependendo da proteção do console, permitir execução de código no processo.","recomendacao":"Desabilitar debug=True em execução acessível a usuários e controlar o modo de execução por configuração segura de ambiente."},{"arquivo":"backend/models.py","linha_inicial":24,"linha_final":27,"cwe":"CWE-327","severidade":"alta","descricao":"As senhas são armazenadas e verificadas usando MD5 sem salt. Um atacante que obtenha o banco ou os hashes pode recuperá-las por ataques offline, possibilitando acesso às contas e reutilização de credenciais.","recomendacao":"Substituir MD5 por um KDF apropriado para senhas, como Argon2id, scrypt ou bcrypt, com salt único por senha, e migrar os hashes existentes."},{"arquivo":"backend/routes/auth_routes.py","linha_inicial":21,"linha_final":23,"cwe":"CWE-89","severidade":"alta","descricao":"O username controlado pelo cliente é interpolado diretamente em um INSERT SQL no endpoint de registro. Um atacante pode manipular a entrada para alterar a consulta, modificar dados ou obter acesso indevido ao banco.","recomendacao":"Usar parâmetros vinculados ou o ORM do SQLAlchemy para inserir o usuário, sem interpolar valores na string SQL."},{"arquivo":"backend/routes/auth_routes.py","linha_inicial":36,"linha_final":37,"cwe":"CWE-89","severidade":"alta","descricao":"O username recebido no login é interpolado diretamente na consulta SELECT. Um atacante pode manipular esse parâmetro para contornar a consulta de autenticação ou extrair dados do banco.","recomendacao":"Substituir a consulta formatada por uma consulta parametrizada ou por User.query.filter_by(username=username).first()."},{"arquivo":"backend/routes/auth_routes.py","linha_inicial":50,"linha_final":50,"cwe":"CWE-321","severidade":"alta","descricao":"Tokens JWT são assinados com a chave fixa \u0027secret\u0027, também usada pelo verificador. Quem obtiver essa chave pode forjar tokens válidos com qualquer user_id e assumir contas sem conhecer suas senhas.","recomendacao":"Usar uma chave criptográfica aleatória, longa e armazenada fora do código, com rotação e proteção adequada."},{"arquivo":"backend/routes/auth_routes.py","linha_inicial":144,"linha_final":146,"cwe":"CWE-639","severidade":"alta","descricao":"O endpoint autenticado de alteração de senha aceita user_id fornecido pelo cliente e altera diretamente esse usuário, sem verificar se ele corresponde a current_user nem exigir privilégio administrativo. Qualquer usuário autenticado pode assumir outras contas.","recomendacao":"Ignorar user_id fornecido pelo cliente e alterar apenas current_user, ou exigir autorização administrativa explícita antes de selecionar outro usuário."},{"arquivo":"backend/routes/auth_routes.py","linha_inicial":157,"linha_final":157,"cwe":"CWE-502","severidade":"alta","descricao":"profile_yaml é controlado pelo usuário autenticado e é desserializado com yaml.Loader. Uma carga YAML especialmente criada pode instanciar objetos e executar código no processo do servidor.","recomendacao":"Usar yaml.safe_load() ou yaml.SafeLoader e aceitar somente a estrutura de dados necessária ao perfil."},{"arquivo":"backend/routes/transaction_routes.py","linha_inicial":14,"linha_final":14,"cwe":"CWE-20","severidade":"alta","descricao":"O valor amount é convertido diretamente de entrada controlada pelo cliente, sem validação de positividade. Com valor negativo, a verificação de saldo passa e as operações seguintes aumentam o saldo do remetente e reduzem o do destinatário, permitindo fraude financeira.","recomendacao":"Validar que amount seja numérico, finito e estritamente maior que zero antes de criar ou aplicar a transferência."},{"arquivo":"backend/routes/transaction_routes.py","linha_inicial":47,"linha_final":49,"cwe":"CWE-89","severidade":"alta","descricao":"user_id vem da query string e é interpolado diretamente na consulta SQL do endpoint de transações. Um atacante autenticado pode manipular a expressão para alterar o filtro e consultar ou extrair transações não autorizadas.","recomendacao":"Usar consulta parametrizada ou ORM e validar também que o usuário solicitado esteja autorizado a consultar essas transações."},{"arquivo":"backend/routes/transaction_routes.py","linha_inicial":47,"linha_final":47,"cwe":"CWE-639","severidade":"alta","descricao":"O endpoint permite que qualquer usuário autenticado escolha user_id arbitrário e não verifica se ele corresponde a current_user ou a uma permissão administrativa. Mesmo sem explorar SQL, isso permite consultar o histórico financeiro de outras contas.","recomendacao":"Remover user_id da entrada para usuários comuns e filtrar sempre por current_user.id; permitir outros identificadores somente após autorização explícita."},{"arquivo":"backend/routes/transaction_routes.py","linha_inicial":93,"linha_final":95,"cwe":"CWE-89","severidade":"alta","descricao":"description é controlada pelo cliente e concatenada diretamente na consulta SQL de busca. Um atacante autenticado pode injetar SQL para modificar a consulta e acessar dados além das próprias transações.","recomendacao":"Usar parâmetros vinculados para o padrão LIKE, escapando curingas conforme a necessidade funcional, ou usar o ORM do SQLAlchemy."}]
