[{"arquivo":"badguys/settings.py","linha_inicial":10,"linha_final":10,"cwe":"CWE-489","severidade":"media","descricao":"DEBUG está permanentemente habilitado. Em uma implantação acessível, erros como o gerado pela rota boom podem expor páginas de depuração com informações internas da aplicação.","recomendacao":"Defina DEBUG=False fora do ambiente de desenvolvimento e configure tratamento de erros sem conteúdo de depuração."},{"arquivo":"badguys/settings.py","linha_inicial":90,"linha_final":90,"cwe":"CWE-321","severidade":"media","descricao":"A chave criptográfica do Django está embutida no código. Qualquer exposição do código permite reutilizar a mesma chave para falsificar valores assinados pelo framework, afetando mecanismos que dependem de SECRET_KEY.","recomendacao":"Carregue SECRET_KEY a partir de um segredo externo à base de código e substitua a chave atualmente exposta."},{"arquivo":"badguys/vulnerable/views.py","linha_inicial":39,"linha_final":43,"cwe":"CWE-22","severidade":"alta","descricao":"O parâmetro GET p controla o caminho passado a os.path.join e open sem validação. Valores com ../ podem escapar de base_path e fazer a aplicação ler arquivos arbitrários acessíveis ao processo, retornando seu conteúdo na resposta.","recomendacao":"Aceite somente nomes de arquivos de uma allowlist ou valide o caminho resolvido para garantir que permaneça dentro de base_path antes de abrir o arquivo."},{"arquivo":"badguys/vulnerable/views.py","linha_inicial":74,"linha_final":74,"cwe":"CWE-95","severidade":"critica","descricao":"O valor POST first_name, controlado pelo cliente, é decodificado de Base64 e executado diretamente com exec. Um atacante sem controle adicional demonstrado pode enviar código Python arbitrário e executar operações com os privilégios do processo Django.","recomendacao":"Remova a execução dinâmica e substitua-a por uma operação fixa que processe apenas os dados esperados."},{"arquivo":"badguys/vulnerable/views.py","linha_inicial":130,"linha_final":136,"cwe":"CWE-639","severidade":"media","descricao":"O userid da URL seleciona diretamente um registro no dicionário users, e a mesma rota aceita POST para alterar nome e e-mail sem verificar a identidade ou autorização do solicitante. Um atacante pode modificar os dados de outro usuário, inclusive do usuário identificado como administrador.","recomendacao":"Exija autenticação e autorização para o objeto solicitado, permitindo a alteração apenas ao próprio usuário ou a um administrador autorizado."},{"arquivo":"badguys/vulnerable/views.py","linha_inicial":178,"linha_final":180,"cwe":"CWE-601","severidade":"media","descricao":"O parâmetro GET url é repassado diretamente a redirect. Um atacante pode induzir usuários a acessar a rota e redirecioná-los para um domínio externo controlado por ele, facilitando phishing.","recomendacao":"Aceite somente destinos relativos ou valide o destino contra uma allowlist de esquemas e domínios permitidos antes do redirecionamento."}]
