[{"arquivo":"app/app.py","linha_inicial":26,"linha_final":26,"cwe":"CWE-321","severidade":"alta","descricao":"A chave HMAC usada para assinar e validar tokens JWT está embutida no código. Quem obtiver o código pode forjar tokens HS256 aceitos por verify_jwt e acessar endpoints protegidos, incluindo dados de clientes.","recomendacao":"Carregar a chave de um armazenamento seguro de segredos, usando valor aleatório, não versionado e rotacionável."},{"arquivo":"app/app.py","linha_inicial":63,"linha_final":63,"cwe":"CWE-798","severidade":"alta","descricao":"A inicialização cria o usuário admin com a senha fixa admin123. Como /login aceita essas credenciais, qualquer atacante que conheça o código ou padrão de implantação pode autenticar como administrador.","recomendacao":"Remover credenciais padrão e exigir configuração segura de uma senha inicial aleatória, com troca obrigatória no primeiro acesso."},{"arquivo":"app/app.py","linha_inicial":97,"linha_final":97,"cwe":"CWE-347","severidade":"alta","descricao":"insecure_verify decodifica o JWT com verify=False e retorna sucesso sem validar assinatura, emissor ou validade. Um atacante pode enviar um token sem assinatura válida ao endpoint /get/\u003ccust_id\u003e e obter dados de qualquer cliente identificado pelo ID.","recomendacao":"Usar jwt.decode com validação obrigatória de assinatura, algoritmo permitido, chave confiável, issuer e claims de validade."},{"arquivo":"app/app.py","linha_inicial":103,"linha_final":114,"cwe":"CWE-96","severidade":"alta","descricao":"O handler de 404 incorpora request.url diretamente no texto passado a render_template_string. Um atacante pode inserir sintaxe Jinja na URL de uma requisição inválida; essa sintaxe será interpretada como template no servidor, possibilitando injeção de template e potencial execução de expressões com impacto no servidor.","recomendacao":"Renderizar uma página estática ou passar a URL como variável para um template fixo, sem interpolá-la no código-fonte do template."},{"arquivo":"app/app.py","linha_inicial":205,"linha_final":211,"cwe":"CWE-639","severidade":"alta","descricao":"Após uma autenticação JWT, /fetch/customer usa diretamente o ID fornecido pelo cliente e não verifica se o usuário autenticado está autorizado a consultar aquele Customer. Qualquer usuário autenticado pode enumerar IDs e obter nomes, e-mails, nomes de usuário e números de cartão de outros clientes.","recomendacao":"Aplicar uma verificação explícita de autorização relacionando o cliente solicitado ao usuário autenticado antes de consultar ou retornar o registro."},{"arquivo":"app/app.py","linha_inicial":261,"linha_final":265,"cwe":"CWE-89","severidade":"alta","descricao":"O valor search controlado pelo cliente é interpolado diretamente na consulta SQL e executado com db.engine.execute. Um atacante autenticado pode alterar a consulta para extrair dados adicionais e, conforme o suporte do mecanismo, modificar a operação SQL.","recomendacao":"Usar consulta parametrizada ou o ORM, passando search como parâmetro vinculado em vez de concatená-lo na string SQL."},{"arquivo":"app/app.py","linha_inicial":271,"linha_final":281,"cwe":"CWE-96","severidade":"alta","descricao":"No tratamento de erros de /search, a exceção, influenciada pelo input usado na consulta SQL, é interpolada diretamente em uma string posteriormente processada por render_template_string. Um atacante pode provocar uma exceção contendo sintaxe de template e obter injeção Jinja no servidor.","recomendacao":"Usar um template fixo e fornecer a mensagem de erro como variável escapada; não construir código-fonte de template com dados de entrada ou exceções."},{"arquivo":"app/app.py","linha_inicial":329,"linha_final":329,"cwe":"CWE-502","severidade":"alta","descricao":"/yaml_hammer aceita um arquivo enviado pelo cliente e o desserializa com yaml.load sem um loader seguro. Um arquivo YAML especialmente criado pode instanciar objetos arbitrários e, em versões afetadas do PyYAML, executar código no processo do servidor.","recomendacao":"Substituir por yaml.safe_load e restringir o conteúdo aos tipos esperados, rejeitando tags e objetos arbitrários."}]
