[{"arquivo":"bad/db.py","linha_inicial":8,"linha_final":12,"cwe":"CWE-798","severidade":"alta","descricao":"A inicialização cria contas, incluindo admin, com senhas conhecidas codificadas no próprio código. Após a execução do inicializador, qualquer atacante que alcance o serviço pode autenticar-se com essas credenciais.","recomendacao":"Remover credenciais padrão e exigir definição segura de senha durante a implantação; armazenar somente hashes de senhas escolhidos pelo administrador."},{"arquivo":"bad/db_init.py","linha_inicial":10,"linha_final":14,"cwe":"CWE-798","severidade":"alta","descricao":"O inicializador grava senhas em texto claro para contas administrativas e comuns. As credenciais ficam diretamente disponíveis no código e permitem acesso às contas se o banco inicializado for usado pelo serviço.","recomendacao":"Não incluir senhas operacionais no código; gerar credenciais únicas durante a implantação e armazenar somente hashes resistentes."},{"arquivo":"bad/libapi.py","linha_inicial":32,"linha_final":33,"cwe":"CWE-639","severidade":"alta","descricao":"O valor do cabeçalho X-APIKEY é concatenado em um padrão usado por Path.glob. Um atacante pode enviar curingas, como \u0027*\u0027, fazendo a busca corresponder a uma chave existente; o primeiro nome correspondente é então aceito e seu usuário é retornado. Em seguida, mod_api.do_post_create usa esse usuário para criar uma publicação sem possuir a chave real.","recomendacao":"Validar a chave como um token literal com formato restrito e comparar valores exatos em uma estrutura de dados, sem inserir entrada do cliente em padrões glob."},{"arquivo":"bad/libsession.py","linha_inicial":16,"linha_final":19,"cwe":"CWE-565","severidade":"alta","descricao":"O cookie vulpy_session contém apenas JSON codificado em Base64 e é carregado sem assinatura ou criptografia autenticada. Um atacante pode fabricar um cookie com qualquer username e obter uma sessão aceita por rotas que dependem de g.session, incluindo publicação, alteração de senha e gerenciamento de MFA.","recomendacao":"Usar o mecanismo de sessão assinado do framework ou um token autenticado com chave mantida fora do código, validando integridade e expiração antes de aceitar o usuário."},{"arquivo":"bad/libuser.py","linha_inicial":12,"linha_final":12,"cwe":"CWE-89","severidade":"alta","descricao":"Username e password recebidos no login são interpolados diretamente na consulta SQL. O endpoint de login encaminha esses valores controláveis pelo atacante, permitindo alterar a lógica da consulta e contornar a autenticação.","recomendacao":"Usar parâmetros vinculados na consulta, separando os valores fornecidos pelo usuário do texto SQL."},{"arquivo":"bad/libuser.py","linha_inicial":25,"linha_final":25,"cwe":"CWE-89","severidade":"alta","descricao":"A criação de usuário, alcançável por dados enviados ao endpoint /user/create, insere username e password por interpolação SQL. Entrada especialmente construída pode modificar a instrução e alterar o banco de dados.","recomendacao":"Substituir a interpolação por uma instrução parametrizada com placeholders e parâmetros separados."},{"arquivo":"bad/libuser.py","linha_inicial":48,"linha_final":48,"cwe":"CWE-89","severidade":"alta","descricao":"A troca de senha constrói UPDATE com password e username interpolados. O password é controlado pela requisição autenticada e pode modificar a consulta, possibilitando alteração indevida de registros além da própria senha.","recomendacao":"Executar o UPDATE com parâmetros vinculados e manter a autorização do usuário separada dos valores usados na consulta."},{"arquivo":"bad/mod_api.py","linha_inicial":47,"linha_final":51,"cwe":"CWE-639","severidade":"media","descricao":"O endpoint GET /api/post/\u003cusername\u003e aceita o identificador de qualquer usuário e consulta seus posts sem autenticação ou verificação de autorização. Um atacante pode enumerar usernames e obter conteúdo associado a outras contas.","recomendacao":"Exigir autenticação e autorizar explicitamente o acesso ao proprietário dos posts ou aplicar uma política de visibilidade pública definida pelo negócio."},{"arquivo":"bad/mod_mfa.py","linha_inicial":56,"linha_final":63,"cwe":"CWE-352","severidade":"media","descricao":"A desativação do MFA é realizada por uma requisição GET autenticada e não possui token CSRF nem outra confirmação vinculada à intenção do usuário. Uma página controlada por atacante pode induzir o navegador de uma vítima autenticada a enviar a requisição, removendo a segunda etapa de autenticação.","recomendacao":"Alterar a operação para POST ou DELETE, exigir token CSRF validado pelo servidor e solicitar reautenticação ou confirmação adicional para desativar o MFA."},{"arquivo":"good/db_init.py","linha_inicial":10,"linha_final":14,"cwe":"CWE-798","severidade":"alta","descricao":"O inicializador inclui senhas conhecidas para contas administrativas e comuns. Se essas contas forem criadas no ambiente servido pela aplicação, as credenciais presentes no código permitem autenticação não autorizada.","recomendacao":"Remover senhas padrão do código, exigir configuração segura durante a implantação e armazenar somente hashes de senhas únicas."},{"arquivo":"good/libsession.py","linha_inicial":8,"linha_final":9,"cwe":"CWE-321","severidade":"alta","descricao":"A chave Fernet usada para proteger todos os cookies de sessão está embutida no código. Qualquer pessoa com acesso ao código pode criar cookies válidos contendo outro username; a função load confia nesse conteúdo e devolve uma sessão autenticada.","recomendacao":"Carregar uma chave aleatória e exclusiva do ambiente de execução ou de um gerenciador de segredos, restringir seu acesso e rotacioná-la quando exposta."}]
