[{"arquivo":"Directory_Traversal/Dir_Traversal.py","linha_inicial":11,"linha_final":14,"cwe":"CWE-22","severidade":"alta","descricao":"O caminho solicitado por self.path é concatenado diretamente ao diretório atual, e a verificação bloqueia apenas o prefixo literal /../../. Um atacante pode usar segmentos como /arquivo/../../segredo para escapar do diretório pretendido; o caminho resultante é então validado com exists e aberto na linha 22, permitindo leitura arbitrária de arquivos acessíveis ao processo.","recomendacao":"Normalize o caminho com os.path.realpath e sirva o arquivo somente se o caminho normalizado permanecer dentro de um diretório-raiz permitido; rejeite componentes .. antes de abrir o arquivo."},{"arquivo":"Other/url_fetch.py","linha_inicial":13,"linha_final":15,"cwe":"CWE-918","severidade":"alta","descricao":"A URL controlada por request.args é aceita quando apenas começa com https://insecurewebapp.com. Essa validação pode ser contornada com URLs como https://insecurewebapp.com@127.0.0.1/, cujo host efetivo é 127.0.0.1. O servidor realiza a requisição e devolve o conteúdo ao atacante, permitindo SSRF contra hosts internos ou serviços acessíveis a partir do servidor.","recomendacao":"Analise a URL com um parser, exija esquema HTTPS e hostname exato de uma allowlist, bloqueie destinos internos após resolução DNS e limite redirecionamentos; não encaminhe respostas arbitrárias sem necessidade."}]
