[{"arquivo":"sqli/dao/student.py","linha_inicial":43,"linha_final":43,"cwe":"CWE-89","severidade":"alta","descricao":"O nome fornecido pelo cliente em students POST chega a Student.create e é interpolado diretamente em uma instrução SQL delimitada por aspas. Um nome contendo sintaxe SQL pode alterar a consulta executada, permitindo injeção SQL, desde que o endpoint esteja acessível ao atacante.","recomendacao":"Use parâmetros do driver, por exemplo execute(\u0027INSERT INTO students (name) VALUES (%(name)s)\u0027, {\u0027name\u0027: name}), sem interpolação da string SQL."},{"arquivo":"sqli/dao/user.py","linha_inicial":40,"linha_final":40,"cwe":"CWE-916","severidade":"media","descricao":"As senhas são verificadas contra um digest MD5 rápido e sem salt visível. Se os hashes armazenados forem obtidos, por exemplo após comprometimento do banco, eles podem ser submetidos a tentativas offline de alta velocidade, facilitando a recuperação de senhas reutilizadas.","recomendacao":"Armazene senhas usando um KDF adaptativo com salt exclusivo por senha, como Argon2id, scrypt, bcrypt ou PBKDF2, e migre os hashes existentes após autenticação bem-sucedida."},{"arquivo":"sqli/views.py","linha_inicial":55,"linha_final":58,"cwe":"CWE-862","severidade":"alta","descricao":"A rota POST /students/ é pública e a função students não aplica authorize nem outra verificação de identidade ou função antes de inserir data[\u0027name\u0027] no banco. Qualquer cliente que alcance a rota pode criar registros de estudantes, comprometendo a integridade dos dados.","recomendacao":"Exija autorização antes do bloco POST, preferencialmente com authorize(ensure_admin=True), e mantenha a criação inacessível a usuários não autorizados."},{"arquivo":"sqli/views.py","linha_inicial":89,"linha_final":94,"cwe":"CWE-862","severidade":"alta","descricao":"A rota POST /courses/ é pública e courses insere título e descrição sem verificar autenticação ou autorização. Um atacante pode criar cursos arbitrários e adulterar o conteúdo apresentado pela aplicação.","recomendacao":"Proteja o endpoint com autorização administrativa antes de processar o POST, por exemplo usando authorize(ensure_admin=True)."},{"arquivo":"sqli/views.py","linha_inicial":125,"linha_final":135,"cwe":"CWE-862","severidade":"media","descricao":"A rota POST /courses/{course_id}/review é pública e Review.create é chamado sem qualquer controle de autenticação ou autorização. Um atacante pode publicar avaliações arbitrárias para cursos existentes, permitindo abuso e comprometimento da integridade do conteúdo.","recomendacao":"Exija autenticação e aplique a autorização definida para criação de avaliações antes de chamar Review.create; se avaliações públicas forem necessárias, implemente controle explícito de abuso e moderação."},{"arquivo":"sqli/views.py","linha_inicial":145,"linha_final":158,"cwe":"CWE-862","severidade":"alta","descricao":"A rota POST /students/{student_id}/evaluate/{course_id} é pública e evaluate grava uma nota validada apenas quanto ao intervalo de 0 a 5. Sem autenticação ou autorização, qualquer atacante pode inserir ou alterar registros de avaliação para qualquer estudante e curso existentes.","recomendacao":"Proteja a função com autenticação e autorização apropriada, preferencialmente authorize(ensure_admin=True) ou uma verificação de permissão equivalente antes de processar e gravar a nota."}]
