[{"arquivo":"app/models/Benefits/benefits.py","linha_inicial":37,"linha_final":42,"cwe":"CWE-22","severidade":"alta","descricao":"O nome do arquivo enviado é controlado pelo atacante e é concatenado com MEDIA_ROOT sem normalização ou validação. Um usuário autenticado pode usar componentes de caminho para gravar o conteúdo fora de media/data, conforme as permissões do processo.","recomendacao":"Use um nome gerado pelo servidor ou valide o caminho final com realpath/commonpath, rejeitando componentes fora de MEDIA_ROOT."},{"arquivo":"app/models/Benefits/benefits.py","linha_inicial":72,"linha_final":74,"cwe":"CWE-78","severidade":"alta","descricao":"make_backup monta um comando shell com full_file_name e orig_file.name derivados do nome do upload. Com backup igual a \"true\", um atacante autenticado pode inserir metacaracteres no nome do arquivo e executar comandos no sistema operacional.","recomendacao":"Substitua os.system por uma operação de cópia sem shell, como shutil.copyfile, usando caminhos validados."},{"arquivo":"app/models/User/user.py","linha_inicial":108,"linha_final":111,"cwe":"CWE-916","severidade":"alta","descricao":"As senhas são armazenadas usando MD5 sem salt. Os hashes também podem ser expostos por serialização de usuários em APIs, permitindo ataque offline eficiente e reutilização de credenciais quando a senha é reutilizada.","recomendacao":"Use o sistema de hashing de senhas do Django, com PBKDF2, Argon2 ou bcrypt, e migre os hashes existentes."},{"arquivo":"app/views/admin/views.py","linha_inicial":34,"linha_final":36,"cwe":"CWE-862","severidade":"alta","descricao":"As funções administrativas exigem apenas a existência de um auth_token; não verificam is_admin nem associam a operação ao papel do usuário. Qualquer usuário autenticado pode acessar operações administrativas, incluindo listar, alterar ou excluir outros usuários.","recomendacao":"Após autenticar, imponha autorização explícita verificando is_admin para todas as rotas administrativas."},{"arquivo":"app/views/api/mobile/views.py","linha_inicial":18,"linha_final":22,"cwe":"CWE-95","severidade":"critica","descricao":"O parâmetro GET class, controlado pelo cliente, é passado diretamente a eval e o resultado é usado para consultar o modelo. Um atacante pode fornecer uma expressão Python arbitrária e obter execução de código no processo; api_id repete o mesmo padrão.","recomendacao":"Substitua eval por um dicionário fixo de classes permitidas e valide o nome contra uma allowlist."},{"arquivo":"app/views/api/users/views.py","linha_inicial":54,"linha_final":70,"cwe":"CWE-863","severidade":"alta","descricao":"A validação extrai o identificador usando uma expressão regular, mas extrapolate_user interpreta novamente o token de forma diferente. Um token com separadores de linha pode ser validado para um identificador e posteriormente interpretado como outro, permitindo personificar outro usuário com um hash válido do próprio atacante.","recomendacao":"Parseie o token uma única vez com formato estrito, rejeite caracteres inesperados e use o identificador validado diretamente para autorização."},{"arquivo":"app/views/api/users/views.py","linha_inicial":13,"linha_final":22,"cwe":"CWE-200","severidade":"alta","descricao":"Após validar o token, a API serializa objetos User inteiros, incluindo campos como password e auth_token. Usuários administrativos podem obter todos os registros e o endpoint não aplica uma seleção de campos seguros.","recomendacao":"Use serializers explícitos com allowlist de campos não sensíveis e nunca retorne credenciais, hashes ou tokens."},{"arquivo":"app/views/password_resets/views.py","linha_inicial":80,"linha_final":84,"cwe":"CWE-502","severidade":"critica","descricao":"O campo user enviado no POST é decodificado e passado diretamente a pickle.loads, sem assinatura ou vínculo confiável com o fluxo de redefinição. Um atacante pode enviar um pickle malicioso e obter execução arbitrária de código no servidor.","recomendacao":"Não desserialize pickle proveniente do cliente; use um identificador opaco assinado, com expiração e vínculo ao usuário."},{"arquivo":"app/views/password_resets/views.py","linha_inicial":43,"linha_final":46,"cwe":"CWE-640","severidade":"alta","descricao":"O token de redefinição é determinístico e derivado apenas de user_id e MD5 do email, sem expiração, nonce ou armazenamento de estado. Quem conhecer o email de um usuário pode reconstruir o token e iniciar a redefinição de senha.","recomendacao":"Gere tokens aleatórios de uso único, armazene apenas seu hash, imponha expiração e invalide-os após o uso."},{"arquivo":"app/views/sessions/views.py","linha_inicial":20,"linha_final":28,"cwe":"CWE-601","severidade":"media","descricao":"O parâmetro path enviado pelo cliente é usado diretamente como destino de HttpResponseRedirect após o login. Um atacante pode induzir a vítima a autenticar-se e ser redirecionada para um site externo controlado por ele.","recomendacao":"Aceite somente destinos locais previamente permitidos ou use uma allowlist de rotas internas."},{"arquivo":"app/views/users/messages/views.py","linha_inicial":25,"linha_final":39,"cwe":"CWE-862","severidade":"media","descricao":"A criação de mensagens usa creator_id e receiver_id fornecidos pelo cliente, sem exigir que creator_id corresponda ao usuário autenticado. Qualquer usuário autenticado pode forjar mensagens em nome de outro usuário e enviá-las a terceiros.","recomendacao":"Defina creator exclusivamente a partir do usuário autenticado e valide autorização sobre o receiver."},{"arquivo":"app/views/users/messages/views.py","linha_inicial":53,"linha_final":69,"cwe":"CWE-639","severidade":"media","descricao":"A mensagem é buscada somente por message_id; user_id da rota não é usado para restringir o objeto ao usuário autenticado. Um usuário autenticado que conheça outro ID pode ler ou excluir mensagens de terceiros.","recomendacao":"Filtre a consulta por proprietário autorizado, por exemplo receiver ou creator igual ao usuário autenticado, antes de ler ou excluir."},{"arquivo":"app/views/users/pay/views.py","linha_inicial":58,"linha_final":63,"cwe":"CWE-639","severidade":"alta","descricao":"A exclusão de Pay.objects.get(id=pay_id) não verifica o usuário autenticado nem o user_id da rota. Qualquer usuário autenticado que conheça um pay_id pode excluir dados bancários de outro usuário.","recomendacao":"Busque o objeto com pay_id e user iguais ao usuário autenticado e rejeite qualquer divergência."},{"arquivo":"app/views/users/work_info/views.py","linha_inicial":14,"linha_final":20,"cwe":"CWE-639","severidade":"alta","descricao":"A view exige apenas autenticação por cookie e carrega User.objects.get(id=user_id) diretamente do identificador da URL. Um usuário autenticado pode trocar user_id e visualizar informações profissionais e SSN de outro usuário.","recomendacao":"Restrinja a consulta ao usuário autenticado ou imponha autorização explícita para acessos administrativos."},{"arquivo":"app/views/users/views.py","linha_inicial":65,"linha_final":72,"cwe":"CWE-89","severidade":"alta","descricao":"user_id_form vem do POST e é interpolado diretamente em uma consulta SQL usada para selecionar o usuário atualizado. Um atacante autenticado pode alterar a cláusula WHERE e modificar outro registro, inclusive campos administrativos.","recomendacao":"Use o ORM com filtros parametrizados, converta o identificador para inteiro e não use SQL construído por concatenação."},{"arquivo":"app/views/users/benefit_forms/views.py","linha_inicial":24,"linha_final":35,"cwe":"CWE-22","severidade":"alta","descricao":"O parâmetro name é controlado pelo cliente e concatenado a BASE_DIR para abrir arquivos. Não há validação de confinamento, permitindo leitura arbitrária de arquivos acessíveis ao processo por meio de traversal.","recomendacao":"Use uma allowlist de arquivos ou valide o caminho normalizado para garantir que permaneça em um diretório de documentos permitido."},{"arquivo":"app/models/Analytics/analytics.py","linha_inicial":43,"linha_final":48,"cwe":"CWE-89","severidade":"alta","descricao":"hits_by_ip interpola diretamente ip e col na consulta SQL. Ambos podem ser influenciados pela requisição administrativa, permitindo injeção na cláusula WHERE e na lista de colunas.","recomendacao":"Use parâmetros para valores e uma allowlist fixa para nomes de colunas; preferencialmente substitua a consulta por filtros do ORM."},{"arquivo":"pygoat/settings.py","linha_inicial":19,"linha_final":19,"cwe":"CWE-321","severidade":"alta","descricao":"A SECRET_KEY usada pela aplicação está embutida no código-fonte. Qualquer pessoa com acesso ao código pode forjar valores assinados pelo Django e comprometer mecanismos que dependam dessa chave.","recomendacao":"Carregue a chave por segredo externo, gere uma chave aleatória por ambiente e faça rotação da chave exposta."},{"arquivo":"pygoat/settings.py","linha_inicial":106,"linha_final":106,"cwe":"CWE-321","severidade":"alta","descricao":"A chave AES usada para proteger dados bancários e SSNs está fixa no código-fonte. A obtenção dos dados armazenados permite sua descriptografia por qualquer pessoa que leia o código.","recomendacao":"Armazene a chave em um gerenciador de segredos ou variável protegida, com rotação e controle de acesso."}]
