[{"arquivo":"app.py","linha_inicial":115,"linha_final":120,"cwe":"CWE-95","severidade":"critica","descricao":"O valor controlado pelo usuário em request.form[\u0027expression\u0027] é executado diretamente por eval(). Um atacante pode enviar uma expressão Python arbitrária pelo endpoint /evaluate, obtendo execução de código no processo do servidor, condicionada à disponibilidade da rota e ao acesso ao serviço.","recomendacao":"Substituir eval() por um avaliador matemático seguro com gramática restrita e allowlist de operações, sem avaliar código Python arbitrário."},{"arquivo":"app.py","linha_inicial":160,"linha_final":162,"cwe":"CWE-611","severidade":"alta","descricao":"XML fornecido pelo usuário é processado por lxml com validação de DTD habilitada e acesso de rede permitido (no_network=False). Isso permite que um documento XML controlado pelo atacante referencie entidades externas, podendo causar leitura de recursos acessíveis ao processo ou requisições server-side, conforme permissões e conectividade do ambiente.","recomendacao":"Usar um parser configurado para não carregar DTDs nem resolver entidades externas, com no_network=True, load_dtd=False e resolve_entities=False."},{"arquivo":"app.py","linha_inicial":193,"linha_final":209,"cwe":"CWE-1336","severidade":"critica","descricao":"O campo name controlado pelo usuário é concatenado no conteúdo de um template e posteriormente interpretado por render_template_string(). Um atacante pode enviar sintaxe Jinja, como expressões ou chamadas permitidas pelo ambiente, causando Server-Side Template Injection e potencial execução de código no servidor, condicionado ao acesso ao endpoint /sayhi.","recomendacao":"Manter o template fixo e passar name como variável ao renderizador, aplicando escape contextual; não concatenar entrada do usuário no texto do template."}]
