[{"arquivo":"app/main.py","linha_inicial":31,"linha_final":31,"cwe":"CWE-400","severidade":"media","descricao":"A requisição ao serviço externo é feita sem timeout. Se o serviço configurado não concluir a conexão ou a resposta, uma requisição ao endpoint raiz pode permanecer bloqueada indefinidamente, consumindo um worker e permitindo indisponibilidade mediante requisições suficientes. O impacto depende da disponibilidade e do comportamento do serviço configurado.","recomendacao":"Definir timeouts explícitos de conexão e leitura em requests.get, tratando as exceções correspondentes."},{"arquivo":"app/main.py","linha_inicial":38,"linha_final":38,"cwe":"CWE-79","severidade":"media","descricao":"O parâmetro name, controlável pelo cliente, é interpolado diretamente em conteúdo HTML retornado ao navegador sem escaping. Um atacante pode enviar marcação ou JavaScript no parâmetro e obter execução no contexto do navegador de quem acessar a resposta.","recomendacao":"Escapar name para HTML antes da interpolação ou usar um template com autoescape habilitado; preferencialmente construir a resposta com mecanismos de escaping do framework."},{"arquivo":"app/main.py","linha_inicial":40,"linha_final":40,"cwe":"CWE-1336","severidade":"alta","descricao":"O conteúdo HTML construído com o parâmetro name é usado como código-fonte de um template por Template(content).render(). Assim, expressões Jinja fornecidas pelo atacante são avaliadas no servidor, permitindo acesso a objetos disponíveis no contexto e potencial execução arbitrária de código, conforme as capacidades do ambiente. A exploração requer apenas acesso ao endpoint e controle do parâmetro name.","recomendacao":"Não compilar entrada do usuário como template; usar um template fixo com name como variável e autoescape habilitado."}]
