[{"arquivo":"target/project/__init__.py","linha_inicial":5,"linha_final":5,"cwe":"CWE-321","severidade":"media","descricao":"A chave secreta usada para assinar a sessão Flask é o valor constante e previsível \"random\". Um atacante que conheça o código pode forjar cookies de sessão e definir valores como loggedin, contornando o controle de acesso observado em /confidential.","recomendacao":"Carregar uma chave aleatória, longa e exclusiva a partir de configuração protegida, sem mantê-la no código-fonte; invalidar sessões emitidas com a chave previsível."},{"arquivo":"target/project/__init__.py","linha_inicial":6,"linha_final":6,"cwe":"CWE-489","severidade":"media","descricao":"O modo de depuração é ativado globalmente. Com o servidor iniciado por runserver.py, erros provocados por requisições podem expor traceback e informações internas; dependendo da configuração do depurador Flask, isso também pode ampliar o impacto para execução de código.","recomendacao":"Desabilitar app.debug em ambientes acessíveis e controlar debug exclusivamente por configuração segura de desenvolvimento."},{"arquivo":"target/project/controllers/404.py","linha_inicial":91,"linha_final":92,"cwe":"CWE-1336","severidade":"alta","descricao":"request.url é controlável pelo atacante, inserido por format diretamente no texto posteriormente processado por render_template_string. Uma URL contendo sintaxe Jinja pode ser avaliada como template no tratamento de uma resposta 404, permitindo SSTI e potencial acesso a dados ou execução de código conforme o ambiente.","recomendacao":"Não concatenar dados da requisição no código do template; passar request.url como variável para um template estático e aplicar escape apropriado."},{"arquivo":"target/project/controllers/About.py","linha_inicial":21,"linha_final":27,"cwe":"CWE-502","severidade":"critica","descricao":"O endpoint POST /about/sync aceita data_obj do atacante, converte o conteúdo hexadecimal em bytes, grava-o e executa pickle.load sem autenticação ou validação. Um payload pickle especialmente construído pode executar código arbitrário no processo do servidor quando desserializado.","recomendacao":"Remover a desserialização pickle de dados não confiáveis; usar um formato de dados não executável, como JSON, com validação de esquema e autenticação/autorização do endpoint."},{"arquivo":"target/project/controllers/Information.py","linha_inicial":17,"linha_final":18,"cwe":"CWE-502","severidade":"alta","descricao":"O parâmetro input da rota é controlável pelo atacante, decodificado em base64 e passado a yaml.load. Em versões/configurações do PyYAML que permitem carregamento de objetos, um YAML especialmente construído pode executar código durante a desserialização.","recomendacao":"Usar yaml.safe_load com validação explícita do tipo e do esquema esperado, ou substituir YAML por um formato não executável."},{"arquivo":"target/project/controllers/Login.py","linha_inicial":12,"linha_final":15,"cwe":"CWE-798","severidade":"media","descricao":"O login aceita as credenciais fixas username=admin e password=admin e cria uma sessão autenticada que redireciona para /confidential. Qualquer pessoa que obtenha acesso ao serviço pode usar essas credenciais embutidas para autenticar sem uma conta legítima.","recomendacao":"Remover credenciais fixas do código, armazenar senhas com hash resistente a brute force e validar credenciais contra uma fonte de identidade protegida."},{"arquivo":"target/project/controllers/Webmaster.py","linha_inicial":7,"linha_final":12,"cwe":"CWE-862","severidade":"alta","descricao":"Qualquer requisição a /webmaster, sem autenticação ou autorização, grava loggedin na sessão. O endpoint /confidential concede acesso apenas com base nesse valor, portanto um atacante pode visitar /webmaster e obter a condição usada para acessar o recurso protegido.","recomendacao":"Remover a alteração de sessão desse endpoint e exigir uma verificação de autenticação e autorização baseada em identidade confiável antes de permitir acesso a /confidential."},{"arquivo":"target/project/controllers/Validator.py","linha_inicial":28,"linha_final":30,"cwe":"CWE-22","severidade":"alta","descricao":"example_file vem diretamente do formulário e é usado para abrir e enviar um arquivo. Sem normalização, validação de diretório permitido ou allowlist de caminhos, um atacante pode fornecer um caminho absoluto ou com traversal para ler arquivos acessíveis ao processo e baixá-los.","recomendacao":"Aceitar somente identificadores de arquivos previamente mapeados no servidor ou resolver o caminho com uma raiz fixa e rejeitar qualquer resultado fora dessa raiz; não usar o caminho fornecido diretamente em open/send_file."},{"arquivo":"target/project/controllers/Validator.py","linha_inicial":44,"linha_final":47,"cwe":"CWE-22","severidade":"alta","descricao":"O nome original do upload é controlado pelo atacante e concatenado diretamente a uploads/ antes de file.save. A extensão permitida não impede componentes ../ ou caminhos equivalentes, possibilitando gravar arquivos fora do diretório de uploads quando o processo tiver permissão.","recomendacao":"Sanitizar o nome com uma função segura como secure_filename, rejeitar separadores e traversal, e salvar exclusivamente sob um diretório fixo após validar o caminho resolvido."},{"arquivo":"target/project/models/Dashboard.py","linha_inicial":7,"linha_final":7,"cwe":"CWE-89","severidade":"alta","descricao":"pageId é proveniente do parâmetro da rota /dashboard/\u003cpageId\u003e e é concatenado diretamente na consulta SQL. Um atacante pode inserir sintaxe SQL no segmento da URL e alterar a consulta executada contra o SQLite, podendo ler ou manipular dados conforme os privilégios da conexão.","recomendacao":"Usar consulta parametrizada, por exemplo WHERE pageId = ?, e validar pageId como inteiro antes de consultar o banco."}]
