[{"arquivo":"app/models/Analytics/analytics.py","linha_inicial":57,"linha_final":60,"cwe":"CWE-89","severidade":"alta","descricao":"hits_by_ip incorpora ip e col diretamente em uma consulta SQL. admin_analytics repassa parâmetros controlados por request.GET, permitindo injeção SQL e leitura ou alteração de dados conforme os privilégios da conexão.","recomendacao":"Use parâmetros para ip e uma allowlist fixa de nomes de colunas; não concatene entrada do usuário na consulta."},{"arquivo":"app/models/Benefits/benefits.py","linha_inicial":73,"linha_final":73,"cwe":"CWE-78","severidade":"alta","descricao":"make_backup executa os nomes de arquivo derivados de uploaded_file.name em os.system. Um atacante autenticado que envie um nome contendo metacaracteres pode executar comandos no servidor quando backup=true.","recomendacao":"Substitua os.system por uma operação de cópia sem shell e valide o nome contra um nome de arquivo seguro."},{"arquivo":"app/models/User/user.py","linha_inicial":107,"linha_final":107,"cwe":"CWE-916","severidade":"alta","descricao":"A senha fornecida pelo usuário é armazenada com MD5 sem salt, algoritmo inadequado para armazenamento de senhas e facilmente sujeito a cracking offline após obtenção do banco.","recomendacao":"Use o sistema de hashing de senhas do Django, como make_password/check_password, com Argon2, PBKDF2 ou bcrypt."},{"arquivo":"app/models/User/user.py","linha_inicial":141,"linha_final":141,"cwe":"CWE-330","severidade":"media","descricao":"auth_token é derivado de random.randint, um gerador não criptográfico com apenas cerca de um milhão de valores possíveis, tornando a previsão ou tentativa sistemática do token plausível na ausência de controles adicionais visíveis.","recomendacao":"Gere tokens com secrets.token_urlsafe ou equivalente criptograficamente seguro e invalide-os adequadamente."},{"arquivo":"app/views/admin/views.py","linha_inicial":14,"linha_final":14,"cwe":"CWE-862","severidade":"alta","descricao":"As operações administrativas são protegidas apenas por user_is_authenticated e não verificam is_admin. Qualquer usuário autenticado pode alcançar endpoints para consultar, listar, alterar ou excluir outros usuários.","recomendacao":"Exija explicitamente privilégios administrativos em cada endpoint, além da autenticação."},{"arquivo":"app/views/api/mobile/views.py","linha_inicial":15,"linha_final":16,"cwe":"CWE-95","severidade":"critica","descricao":"O parâmetro class, controlado pelo cliente e recebido sem autenticação, é avaliado com eval. Isso permite fornecer uma expressão Python arbitrária e executar código no processo do servidor.","recomendacao":"Elimine eval e substitua-o por uma allowlist explícita de modelos ou identificadores aceitos."},{"arquivo":"app/views/api/mobile/views.py","linha_inicial":26,"linha_final":27,"cwe":"CWE-95","severidade":"critica","descricao":"O endpoint de consulta por id também avalia diretamente o parâmetro class controlado pelo cliente. Um atacante não autenticado pode executar expressões Python arbitrárias no servidor.","recomendacao":"Elimine eval e use uma allowlist explícita de modelos, validando também o identificador solicitado."},{"arquivo":"app/views/api/users/views.py","linha_inicial":18,"linha_final":19,"cwe":"CWE-359","severidade":"alta","descricao":"A API serializa User diretamente, incluindo campos do modelo como password e auth_token. Um token válido permite que um administrador obtenha essas informações de todos os usuários, e um usuário comum recebe seus próprios segredos.","recomendacao":"Serialize somente campos necessários e nunca inclua password, auth_token ou outros segredos nas respostas."},{"arquivo":"app/views/password_resets/views.py","linha_inicial":67,"linha_final":67,"cwe":"CWE-502","severidade":"critica","descricao":"confirm_token envia um objeto User serializado com pickle ao cliente, e reset_password aceita e desserializa o valor POST sem assinatura ou integridade. Um atacante pode enviar um pickle malicioso ao endpoint público e obter execução arbitrária de código.","recomendacao":"Não transporte objetos pickle; use um identificador opaco de uso único armazenado no servidor ou um token assinado, e atualize a senha após validar esse token."},{"arquivo":"app/views/password_resets/views.py","linha_inicial":84,"linha_final":84,"cwe":"CWE-502","severidade":"critica","descricao":"reset_password executa pickle.loads sobre dados controlados pelo cliente antes de qualquer autenticação adicional. A desserialização pode executar código arbitrário no servidor.","recomendacao":"Substitua pickle por dados estruturados seguros e valide um token de redefinição assinado e de uso único."},{"arquivo":"app/views/password_resets/views.py","linha_inicial":45,"linha_final":45,"cwe":"CWE-640","severidade":"alta","descricao":"O token de redefinição é calculado apenas como user_id e MD5(email), sem segredo ou expiração. Quem conhecer o identificador e o email de uma conta pode forjar um token válido e redefinir sua senha.","recomendacao":"Use tokens aleatórios, longos, armazenados ou assinados com segredo fora do código, com expiração e uso único."},{"arquivo":"app/views/sessions/views.py","linha_inicial":39,"linha_final":39,"cwe":"CWE-601","severidade":"media","descricao":"O valor path enviado pelo cliente é usado diretamente em HttpResponseRedirect após login. Um atacante pode induzir a vítima a autenticar-se em uma URL controlada pelo atacante, possibilitando phishing e encaminhamento para destino externo.","recomendacao":"Aceite somente caminhos locais allowlisted ou use uma URL fixa após autenticação."},{"arquivo":"app/views/users/benefit_forms/views.py","linha_inicial":27,"linha_final":27,"cwe":"CWE-22","severidade":"alta","descricao":"download concatena BASE_DIR com o parâmetro name controlado pelo cliente e abre o caminho resultante. Um usuário autenticado pode usar ../ para acessar arquivos arbitrários legíveis pelo processo.","recomendacao":"Resolva o caminho dentro de um diretório permitido e rejeite qualquer caminho que escape desse diretório; prefira identificadores de arquivos armazenados no servidor."},{"arquivo":"app/views/users/messages/views.py","linha_inicial":29,"linha_final":36,"cwe":"CWE-862","severidade":"media","descricao":"O usuário autenticado pode escolher creator_id e receiver_id arbitrários ao criar uma mensagem. Não há verificação de que o criador corresponde ao usuário autenticado, permitindo falsificação de remetente e envio em nome de terceiros.","recomendacao":"Derive creator exclusivamente do usuário autenticado e autorize explicitamente o destinatário."},{"arquivo":"app/views/users/messages/views.py","linha_inicial":45,"linha_final":45,"cwe":"CWE-639","severidade":"alta","descricao":"A mensagem é buscada somente por message_id, sem restringir ao usuário autenticado ou ao destinatário. Um usuário autenticado que conheça outro ID pode ler a mensagem de terceiros e, via DELETE, apagá-la.","recomendacao":"Filtre a consulta por message_id e por creator ou receiver igual ao usuário autenticado, conforme a operação."},{"arquivo":"app/views/users/pay/views.py","linha_inicial":71,"linha_final":71,"cwe":"CWE-639","severidade":"alta","descricao":"A exclusão de pagamento usa somente pay_id e não verifica a propriedade do registro. Um usuário autenticado que obtenha o ID de outro pagamento pode excluí-lo.","recomendacao":"Busque o pagamento usando simultaneamente pay_id e o usuário autenticado, e negue registros de terceiros."},{"arquivo":"app/views/users/views.py","linha_inicial":74,"linha_final":76,"cwe":"CWE-89","severidade":"alta","descricao":"user_id_form vem do POST e é interpolado em uma consulta raw SQL. Um atacante autenticado pode injetar SQL, selecionar outro usuário e alterar dados de sua conta, inclusive a senha.","recomendacao":"Use o ORM ou uma consulta parametrizada e derive o usuário alvo de uma autorização explícita, não de SQL construído por string."},{"arquivo":"app/views/users/work_info/views.py","linha_inicial":16,"linha_final":16,"cwe":"CWE-639","severidade":"alta","descricao":"O endpoint usa diretamente o user_id da URL para carregar WorkInfo, embora a autenticação apenas valide que existe algum usuário autenticado. Qualquer usuário pode trocar o ID e visualizar dados pessoais, incluindo SSN, de outra conta.","recomendacao":"Restrinja a consulta ao usuário autenticado ou implemente uma verificação explícita de autorização para o recurso solicitado."}]
