[{"arquivo":"bad/api_post.py","linha_inicial":27,"linha_final":28,"cwe":"CWE-922","severidade":"media","descricao":"A chave de API recebida do servidor é gravada em /tmp/supersecret.txt usando permissões padrão e depois reutilizada para autenticação. Em sistemas onde outros usuários locais conseguem ler o arquivo, podem obter a chave e postar em nome do usuário autenticado.","recomendacao":"Armazene a chave em diretório privado, crie o arquivo com permissões restritivas e use armazenamento seguro de credenciais."},{"arquivo":"bad/libapi.py","linha_inicial":20,"linha_final":22,"cwe":"CWE-522","severidade":"media","descricao":"A chave de API é armazenada como parte do nome de um arquivo em /tmp. Listagens do diretório podem expor diretamente o bearer token a outros usuários locais, permitindo autenticação como o usuário correspondente.","recomendacao":"Armazene tokens em arquivos privados, com permissões restritivas, e não inclua segredos em nomes de arquivos acessíveis globalmente."},{"arquivo":"bad/libapi.py","linha_inicial":33,"linha_final":34,"cwe":"CWE-287","severidade":"alta","descricao":"authenticate constrói um padrão glob incorporando diretamente o valor X-APIKEY controlado pelo cliente. Um valor contendo curingas, como *, pode corresponder a qualquer arquivo de chave existente e fazer a função retornar o usuário associado sem conhecer a chave válida, contornando a autenticação da API.","recomendacao":"Compare o token com valores exatos, sem glob; valide o formato do token e use armazenamento indexado por comparação segura."},{"arquivo":"bad/libsession.py","linha_inicial":20,"linha_final":20,"cwe":"CWE-565","severidade":"alta","descricao":"O cookie de sessão contém apenas JSON codificado em Base64, sem assinatura ou criptografia autenticada. Um atacante pode fabricar um cookie com qualquer username; load() o aceita e as rotas usam o valor como identidade autenticada, permitindo acesso e ações em nome de outro usuário.","recomendacao":"Use sessões assinadas pelo framework ou tokens autenticados e rejeite qualquer cookie sem integridade verificável."},{"arquivo":"bad/libuser.py","linha_inicial":12,"linha_final":12,"cwe":"CWE-89","severidade":"alta","descricao":"login incorpora username e password, recebidos dos formulários de login, diretamente na consulta SQL. Um atacante pode manipular os valores para alterar a condição WHERE e contornar a autenticação ou consultar dados indevidos.","recomendacao":"Use parâmetros vinculados na consulta, por exemplo WHERE username = ? AND password = ?, e valide os erros de autenticação."},{"arquivo":"bad/libuser.py","linha_inicial":25,"linha_final":25,"cwe":"CWE-89","severidade":"media","descricao":"create concatena username e password controlados pelo usuário na instrução INSERT. Um atacante pode injetar sintaxe SQL e alterar os valores ou a estrutura lógica da operação de criação de contas.","recomendacao":"Substitua a interpolação por uma instrução parametrizada com placeholders para todos os campos."},{"arquivo":"bad/libuser.py","linha_inicial":53,"linha_final":53,"cwe":"CWE-89","severidade":"alta","descricao":"password_change concatena password e username na instrução UPDATE. Valores controlados pelo usuário podem modificar a cláusula WHERE ou a expressão atualizada, permitindo alterar senhas de outras contas ou corromper dados.","recomendacao":"Use UPDATE parametrizado para password e username e restrinja a alteração à identidade autorizada."},{"arquivo":"bad/mod_api.py","linha_inicial":48,"linha_final":50,"cwe":"CWE-862","severidade":"alta","descricao":"A rota GET /api/post/\u003cusername\u003e aceita qualquer username e retorna os posts correspondentes sem autenticação ou autorização. Um atacante não autenticado pode enumerar usuários e ler conteúdo privado de qualquer conta.","recomendacao":"Exija autenticação e autorize explicitamente o acesso ao proprietário dos posts ou a uma permissão de leitura apropriada."},{"arquivo":"bad/mod_mfa.py","linha_inicial":64,"linha_final":64,"cwe":"CWE-352","severidade":"media","descricao":"A rota de desativação de MFA executa uma alteração de estado em uma requisição GET autenticada, sem token CSRF. Um site controlado pelo atacante pode induzir o navegador de uma vítima autenticada a acessar essa URL e desativar o MFA da conta.","recomendacao":"Altere a operação para POST, valide um token CSRF e mantenha a verificação de autorização da sessão."}]
