{"arquivo":"Directory_Traversal/Dir_Traversal.py","linha_inicial":9,"linha_final":12,"cwe":"CWE-22","severidade":"alta","descricao":"Requisições HTTP controladas pelo atacante são concatenadas diretamente ao diretório de trabalho em `path += self.path`. A validação bloqueia apenas caminhos que começam exatamente com `/../../`, permitindo contornar o filtro com prefixos como `/x/../../`. O caminho resultante é usado em `exists` e posteriormente aberto para leitura, possibilitando a um atacante não autenticado acessar arquivos legíveis fora do diretório pretendido através do servidor exposto em todas as interfaces.","recomendacao":"Resolver o caminho com `os.path.realpath` ou `Path.resolve`, verificar que ele permanece dentro de um diretório-raiz permitido e rejeitar qualquer caminho que escape dessa raiz antes de abrir o arquivo."}
