[{"arquivo":"app.py","linha_inicial":26,"linha_final":26,"cwe":"CWE-256","severidade":"media","descricao":"A senha do usuário é armazenada diretamente em User.password e comparada em texto claro no login. Qualquer obtenção do banco SQLite permite recuperar as credenciais em massa, com possível reutilização em outros serviços; o impacto depende do acesso ao arquivo do banco.","recomendacao":"Armazene somente hashes de senha usando um algoritmo adaptativo como Argon2id, bcrypt ou scrypt, e valide as credenciais com uma função segura de verificação."},{"arquivo":"app.py","linha_inicial":121,"linha_final":121,"cwe":"CWE-95","severidade":"critica","descricao":"O valor controlado por request.form[\u0027expression\u0027] é executado diretamente por eval(). Um atacante não autenticado pode enviar uma expressão Python arbitrária e executar código com os privilégios do processo Flask, comprometendo a confidencialidade, integridade e disponibilidade do servidor.","recomendacao":"Remova eval() e implemente uma avaliação restrita baseada em parser e allowlist de operações e tipos permitidos."},{"arquivo":"app.py","linha_inicial":157,"linha_final":157,"cwe":"CWE-611","severidade":"alta","descricao":"O XML controlado pelo cliente é processado com XMLParser(dtd_validation=True, no_network=False). A validação de DTD habilita o processamento necessário para entidades externas e no_network=False permite resolução de recursos de rede; um atacante pode explorar XXE para ler recursos locais ou induzir requisições de saída, conforme as permissões do processo.","recomendacao":"Desabilite DTDs e entidades externas e use um parser configurado explicitamente com load_dtd=False, resolve_entities=False e no_network=True, ou uma biblioteca de parsing segura para entrada não confiável."},{"arquivo":"app.py","linha_inicial":203,"linha_final":204,"cwe":"CWE-1336","severidade":"alta","descricao":"A entrada request.form[\u0027name\u0027] é interpolada no texto de um template e o resultado é processado por render_template_string(). Um atacante pode inserir sintaxe do mecanismo Jinja, que será avaliada como parte do template, possibilitando SSTI e potencial execução de código no contexto do servidor.","recomendacao":"Passe name como variável para um template estático e deixe o mecanismo escapar a saída, por exemplo usando render_template() com {{ name }}; não concatene entrada do usuário no código do template."}]
